{
  "interface_id": "CUSTOS-SANCTUM-FEDERATION",
  "interface_version": "1.0.0",
  "status": "AVAILABLE",
  "minister": {
    "minister_id": "MIN-000000001",
    "manifest_id": "MNF-000000001",
    "manifest_version": "1.1.0",
    "name": "Leo Strauss",
    "office": "Minister of Political Philosophy"
  },
  "repository": {
    "full_name": "izzy9118-blip/custos",
    "canonical_authority": "GIT"
  },
  "contract_source": {
    "repository_full_name": "izzy9118-blip/Sanctum",
    "git_commit": "9998d1473cf6ac10ed00991c40afd3d5e4e3644a"
  },
  "contracts": {
    "inquiry_envelope": {
      "schema_id": "urn:sanctum:federation:inquiry-envelope:1.0.0",
      "source_path": "inquiry-envelope.schema.json",
      "vendored_path": "inquiry_engine/src/custos_engine/federation/schemas/inquiry-envelope.schema.json",
      "sha256": "ca22329e517e97232fbb90cdd7e24fb8cc8ff084e25d7e46d423911ef3f727a7",
      "source_git_blob_sha": "beda481b8207c6d30ba263ee62f56f16498f32b2"
    },
    "ministerial_report": {
      "schema_id": "urn:sanctum:federation:ministerial-report:1.0.0",
      "source_path": "ministerial-report.schema.json",
      "vendored_path": "inquiry_engine/src/custos_engine/federation/schemas/ministerial-report.schema.json",
      "sha256": "3f293e150695842c6cbd091093f6be9c0bd3d420a94efc4619b76a6789ff650d",
      "source_git_blob_sha": "d14615fedce558df7f4b33104747e627ef6400e0"
    }
  },
  "engine": {
    "name": "Custos Inquiry Engine",
    "version": "0.2.0",
    "governed_commit": "55a9a75a7857a91f6db19a323668d20da3c83af3",
    "manifest_git_commit": "55d6f7ad16f3f3de5ea237c3c718bd42d81f3534",
    "manifest_path": "manifests/cognitive-memory/MAN-000000001.json",
    "manifest_schema_path": "inquiry_engine/src/custos_engine/schemas/cognitive_memory_manifest.schema.json",
    "taxonomy_schema_path": "inquiry_engine/src/custos_engine/schemas/taxonomy_component.schema.json",
    "procedure_schema_path": "inquiry_engine/src/custos_engine/schemas/procedure.schema.json"
  },
  "evidence_bundle": {
    "schema_id": "urn:custos:federation:evidence-bundle:1.0.0",
    "vendored_path": "inquiry_engine/src/custos_engine/federation/schemas/evidence-bundle.schema.json",
    "sha256": "fa85770cbee73ba5210019b76d99bda7a83d2f23dc00334937cd36abad984dba"
  },
  "output": {
    "report_path": "ministerial-report.json",
    "candidate_only": true,
    "secretary_validation_status": "NOT_YET_VALIDATED"
  },
  "limitations": [
    "The adapter emits a candidate Ministerial Report; only Sanctum's Secretary may validate its Assembly provenance or record certification.",
    "The interface does not activate, certify, admit, or modify Custos cognitive memory or canonical documentary objects.",
    "Version 1.0 accepts one preselected, content-addressed evidence bundle and does not require Neo4j Aura.",
    "External phase-reasoner outputs remain candidate statements governed by Custos epistemic and evidence-reference checks."
  ]
}
